{
  "schema_version": "gis_felt_export_v1",
  "city": "Calgary",
  "zone": "RCG",
  "source_document": null,
  "source_url": "https://www.calgary.ca/content/dam/www/pda/pd/documents/calgary-land-use-bylaw-1p2007/land-use-bylaw-1p2007.pdf",
  "input_mode": "native_rag_llm",
  "consumer_notes": [
    "This export is derived only from verified_rules.json.",
    "Review, rejected, and not_used rules are not executable constraints.",
    "Map consumers should display review_blockers as warnings, not apply them as zoning logic."
  ],
  "map_layer_requirements": [
    {
      "layer_key": "building_footprint",
      "description": "Building footprint polygons for height, storey, separation, and coverage limits.",
      "example_team_file": "code/gis_files/calgary/building_footprint.gpkg"
    },
    {
      "layer_key": "front_lot_line",
      "description": "Front lot-line segments for verified front street-yard setbacks.",
      "example_team_file": "code/gis_files/calgary/front_lot_line.gpkg"
    },
    {
      "layer_key": "rear_lot_line",
      "description": "Rear lot-line segments for rear-yard setbacks.",
      "example_team_file": "code/gis_files/calgary/rear_lot_line.gpkg"
    },
    {
      "layer_key": "side_lot_line",
      "description": "Side lot-line segments for interior and flanking side-yard setbacks.",
      "example_team_file": "code/gis_files/calgary/side_lot_line.gpkg"
    }
  ],
  "buildable_area_parameters": {
    "building_height_m__5": {
      "parameter_key": "building_height_m__5",
      "value": "5.0",
      "value_numeric": 5.0,
      "unit": "m",
      "operator": "<=",
      "geometry_target": "building_footprint",
      "source_rule_ids": [
        "calgary_rcg_079"
      ],
      "source_pages": [
        396
      ],
      "conditions": [
        "measured from grade at a side property line shared with a parcel designated with a low density residential district"
      ]
    },
    "building_height_m__7_5": {
      "parameter_key": "building_height_m__7_5",
      "value": "7.5",
      "value_numeric": 7.5,
      "unit": "m",
      "operator": "<=",
      "geometry_target": "building_footprint",
      "source_rule_ids": [
        "calgary_rcg_012"
      ],
      "source_pages": [
        396
      ],
      "conditions": []
    },
    "building_height_m__8_6": {
      "parameter_key": "building_height_m__8_6",
      "value": "8.6",
      "value_numeric": 8.6,
      "unit": "m",
      "operator": "<=",
      "geometry_target": "building_footprint",
      "source_rule_ids": [
        "calgary_rcg_056",
        "calgary_rcg_130"
      ],
      "source_pages": [
        473
      ],
      "conditions": [
        "not located on a corner parcel, for any portion of a main residential building located between the rear property line and 60.0 per cent parcel depth or the contextual building depth average",
        "not located on a corner parcel"
      ]
    },
    "building_height_m__11": {
      "parameter_key": "building_height_m__11",
      "value": "11.0",
      "value_numeric": 11.0,
      "unit": "m",
      "operator": "<=",
      "geometry_target": "building_footprint",
      "source_rule_ids": [
        "calgary_rcg_055"
      ],
      "source_pages": [
        472
      ],
      "conditions": []
    },
    "building_separation_m__5": {
      "parameter_key": "building_separation_m__5",
      "value": "5.0",
      "value_numeric": 5.0,
      "unit": "m",
      "operator": ">=",
      "geometry_target": "building_footprint",
      "source_rule_ids": [
        "calgary_rcg_020",
        "calgary_rcg_082",
        "calgary_rcg_138"
      ],
      "source_pages": [
        396
      ],
      "conditions": [
        "between the closest façade of the main residential building to the closest façade of a Backyard Suite. 10P2019"
      ]
    },
    "building_separation_m__6_5": {
      "parameter_key": "building_separation_m__6_5",
      "value": "6.5",
      "value_numeric": 6.5,
      "unit": "m",
      "operator": ">=",
      "geometry_target": "building_footprint",
      "source_rule_ids": [
        "calgary_rcg_028"
      ],
      "source_pages": [
        470
      ],
      "conditions": [
        "on a laned parcel"
      ]
    },
    "max_floor_area_m2__75": {
      "parameter_key": "max_floor_area_m2__75",
      "value": "75.0",
      "value_numeric": 75.0,
      "unit": "m2",
      "operator": "<=",
      "geometry_target": "building_footprint",
      "source_rule_ids": [
        "calgary_rcg_084"
      ],
      "source_pages": [
        396
      ],
      "conditions": []
    },
    "max_floor_area_m2__100": {
      "parameter_key": "max_floor_area_m2__100",
      "value": "100.0",
      "value_numeric": 100.0,
      "unit": "m2",
      "operator": "<=",
      "geometry_target": "building_footprint",
      "source_rule_ids": [
        "calgary_rcg_083"
      ],
      "source_pages": [
        395
      ],
      "conditions": [
        "(a) in the R-C1L, R-C1Ls, R-C1, R-C1s, R-C1N, R-1, R-1s and 24P2018 R-1N Districts; or (b) when located on a parcel with a parcel width less than 13.0 metres"
      ]
    },
    "max_lot_coverage_pct": {
      "parameter_key": "max_lot_coverage_pct",
      "value": "45.0",
      "value_numeric": 45.0,
      "unit": "%",
      "operator": "<=",
      "geometry_target": "building_footprint",
      "source_rule_ids": [
        "calgary_rcg_026"
      ],
      "source_pages": [
        470
      ],
      "conditions": []
    },
    "setback_front_setback": {
      "parameter_key": "setback_front_setback",
      "value": "6.0",
      "value_numeric": 6.0,
      "unit": "m",
      "operator": ">=",
      "geometry_target": "front_lot_line",
      "source_rule_ids": [
        "calgary_rcg_081"
      ],
      "source_pages": [
        398
      ],
      "conditions": [
        "Developed Area and R-C1L or R-C1Ls districts"
      ]
    },
    "setback_setback__0_6": {
      "parameter_key": "setback_setback__0_6",
      "value": "0.6",
      "value_numeric": 0.6,
      "unit": "m",
      "operator": ">=",
      "geometry_target": "side_lot_line",
      "source_rule_ids": [
        "calgary_rcg_064",
        "calgary_rcg_073"
      ],
      "source_pages": [
        471,
        472
      ],
      "conditions": [
        "on a laned parcel",
        "corner parcel"
      ]
    },
    "setback_setback__1_2": {
      "parameter_key": "setback_setback__1_2",
      "value": "1.2",
      "value_numeric": 1.2,
      "unit": "m",
      "operator": ">=",
      "geometry_target": "side_lot_line",
      "source_rule_ids": [
        "calgary_rcg_013",
        "calgary_rcg_069"
      ],
      "source_pages": [
        471,
        472
      ],
      "conditions": [
        "laned or corner parcel"
      ]
    },
    "setback_setback__1_5": {
      "parameter_key": "setback_setback__1_5",
      "value": "1.5",
      "value_numeric": 1.5,
      "unit": "m",
      "operator": ">=",
      "geometry_target": "rear_lot_line",
      "source_rule_ids": [
        "calgary_rcg_006"
      ],
      "source_pages": [
        395
      ],
      "conditions": [
        "rear property line"
      ]
    },
    "setback_setback__3": {
      "parameter_key": "setback_setback__3",
      "value": "3.0",
      "value_numeric": 3.0,
      "unit": "m",
      "operator": ">=",
      "geometry_target": "side_lot_line",
      "source_rule_ids": [
        "calgary_rcg_004",
        "calgary_rcg_067"
      ],
      "source_pages": [
        470
      ],
      "conditions": [
        "main residential building on a corner parcel"
      ]
    },
    "setback_setback__7_5": {
      "parameter_key": "setback_setback__7_5",
      "value": "7.5",
      "value_numeric": 7.5,
      "unit": "m",
      "operator": ">=",
      "geometry_target": "rear_lot_line",
      "source_rule_ids": [
        "calgary_rcg_074"
      ],
      "source_pages": [
        472
      ],
      "conditions": []
    }
  },
  "constraints": [
    {
      "constraint_id": "calgary_rcg_004",
      "source_rule_id": "calgary_rcg_004",
      "rule_object": "setback",
      "parameter_key": "setback_setback",
      "export_group": "buildable_area",
      "geometry_target": "side_lot_line",
      "geometry": {
        "operation": "offset_inward",
        "axis": "side_lot_line",
        "direction": "inward",
        "source_fields": [
          "rule_object",
          "evidence_lot_line"
        ]
      },
      "operator": ">=",
      "value": "3.0",
      "value_numeric": 3.0,
      "unit": "m",
      "applies_to": "side property line shared with another parcel",
      "condition": "main residential building on a corner parcel",
      "exception": "",
      "applicability": null,
      "gis_relevance": "direct",
      "gis_ready": true,
      "source_page": 470,
      "source_evidence_id": "m4_pack_0002_ev_001",
      "source_quote": "minimum building setback from the side property line shared with another parcel is 3.0 metres",
      "felt_popup_sentence": "side property line shared with another parcel: setback for setback must be at least 3.0 m when main residential building on a corner parcel."
    },
    {
      "constraint_id": "calgary_rcg_006",
      "source_rule_id": "calgary_rcg_006",
      "rule_object": "setback",
      "parameter_key": "setback_setback",
      "export_group": "buildable_area",
      "geometry_target": "rear_lot_line",
      "geometry": {
        "operation": "offset_inward",
        "axis": "rear_lot_line",
        "direction": "inward",
        "source_fields": [
          "rule_object",
          "evidence_lot_line"
        ]
      },
      "operator": ">=",
      "value": "1.5",
      "value_numeric": 1.5,
      "unit": "m",
      "applies_to": "Backyard Suite",
      "condition": "rear property line",
      "exception": "",
      "applicability": null,
      "gis_relevance": "direct",
      "gis_ready": true,
      "source_page": 395,
      "source_evidence_id": "m4_pack_0003_ev_001",